MCHR2	"GPR145, MCH2, MCH2R, SLT"	ENSG00000152034	"Melanin concentrating hormone receptor 2"	Q969V1	6	99918519-99994247	"G-protein coupled receptors, Predicted membrane proteins"		"G-protein coupled receptor, Receptor, Transducer"		"Evidence at protein level"	"Evidence at transcript level"	"Evidence at protein level"	"Evidence at protein level"	"Group enriched"	"Detected in some"	18	"brain: 5.1;testis: 1.5"	"Cell type enriched"	"Detected in some"	29	"Excitatory neurons: 42.6"	"Cell type enhanced"	"Detected in many"		"deep-layer intratelencephalic: 69.1;upper-layer intratelencephalic: 116.6"	"Not detected"	"Not detected"			"Low region specificity"	"Detected in many"			"Not detected in immune cells"	"Not detected"			"Not detected"	"Not detected"			"Not detected"	"Not detected"			"Testis - Early spermatids"					"Low region specificity"	"Detected in many"										NA	NA				"Cluster 5: Brain & Testis - Signal transduction"	"Cluster 53: Neurons - Mixed function"	"Cluster 21: Lymphoma - Adaptive immune response"	"Cluster 34: Neurons - Neuronal signaling"																																			
MLNR	GPR38	ENSG00000102539	"Motilin receptor"	O43193	13	49220338-49222377	"G-protein coupled receptors, Predicted membrane proteins"		"G-protein coupled receptor, Receptor, Transducer"		"Evidence at protein level"	"Evidence at transcript level"	"Evidence at transcript level"	"Evidence at protein level"	"Tissue enhanced"	"Detected in some"		"bone marrow: 1.3;thyroid gland: 1.6"	"Not detected"	"Not detected"			"Not detected"	"Not detected"			"Cancer enriched"	"Detected in single"	5	"Testicular Germ Cell Tumor (TCGA): 2.7"	"Low region specificity"	"Detected in all"			"Not detected in immune cells"	"Not detected"			"Not detected"	"Not detected"			"Not detected"	"Not detected"								"Not detected"	"Not detected"			HPA070324			Approved	"Plasma membrane,Cytosol"			NA	NA				"Cluster 40: Non-specific - Transcription"	"Cluster 19: Astrocytes - Mixed function"	"Cluster 4: Non-specific - Transcription"			"Plasma membrane, Cytosol"		"HPA070324: "																													"unprognostic (3.40e-1)"		
MRGPRD	mrgD	ENSG00000172938	"MAS related GPR family member D"	Q8TDS7	11	68980021-68980986	"G-protein coupled receptors, Predicted membrane proteins"		"G-protein coupled receptor, Receptor, Transducer"		"Evidence at protein level"	"Evidence at transcript level"	"Evidence at protein level"	"Evidence at transcript level"	"Not detected"	"Not detected"			"Not detected"	"Not detected"			"Not detected"	"Not detected"			"Not detected"	"Not detected"			"Low region specificity"	"Detected in some"			"Not detected in immune cells"	"Not detected"			"Not detected"	"Not detected"			"Not detected"	"Not detected"				"Not detected"	"Not detected"			"Not detected"	"Not detected"			HPA031346	Uncertain						NA	NA					"Cluster 15: Non-specific - Transcription"	"Cluster 59: Leukemia - T-cell receptor"					"HPA031346: AB_10602710"																															
MRGPRE	"GPR167, mrgE"	ENSG00000184350	"MAS related GPR family member E"	Q86SM8	11	3225030-3232417	"G-protein coupled receptors, Predicted membrane proteins"		"G-protein coupled receptor, Receptor, Transducer"		"Evidence at transcript level"	"Evidence at transcript level"	"Evidence at transcript level"	"Evidence at transcript level"	"Not detected"	"Not detected"			"Cell type enhanced"	"Detected in some"		"Bipolar cells: 1.1;Erythroid cells: 1.1;Horizontal cells: 2.5"	"Cell type enhanced"	"Detected in some"		"lower rhombic lip: 9.8;mammillary body: 8.1"	"Group enriched"	"Detected in some"	4	"Kidney Renal Papillary Cell Carcinoma (TCGA): 1.3;Thyroid Carcinoma (TCGA): 2.8"	"Region enhanced"	"Detected in many"		"pons: 58.2"	"Not detected in immune cells"	"Not detected"			"Not detected"	"Not detected"			"Not detected"	"Not detected"				"Low region specificity"	"Detected in all"							HPA046556	Uncertain						NA	NA					"Cluster 49: Hindbrain - Mixed function"	"Cluster 10: Ciliated cells - Ion channel activity"	"Cluster 71: Horizontal & Bipolar cells - Neuronal signaling"				"HPA046556: AB_10961404"													"unprognostic (3.17e-1)"																	"unprognostic (8.04e-2)"	
MRGPRF	"GPR140, GPR168, MGC21621, mrgF"	ENSG00000172935	"MAS related GPR family member F"	Q96AM1	11	69004395-69013382	"G-protein coupled receptors, Predicted intracellular proteins, Predicted membrane proteins, Transporters"		"G-protein coupled receptor, Receptor, Transducer"		"Evidence at protein level"	"Evidence at transcript level"	"Evidence at transcript level"	"Evidence at protein level"	"Tissue enhanced"	"Detected in many"		"endometrium 1: 165.4;intestine: 153.8"	"Cell type enhanced"	"Detected in many"		"Fibroblasts: 30.0;Leydig cells: 66.2;Mesothelial cells: 31.1;Ovarian stromal cells: 29.9;Peritubular cells: 97.6;Smooth muscle cells: 96.5"	"Group enriched"	"Detected in some"	5	"fibroblast: 26.4;vascular associated smooth muscle cell: 75.5"	"Low cancer specificity"	"Detected in all"			"Region enhanced"	"Detected in all"		"cerebellum: 21.9"	"Not detected in immune cells"	"Not detected"			"Not detected"	"Not detected"			"Cancer enhanced"	"Detected in many"		"Brain cancer: 7.4"	"Breast - Smooth muscle cells, Colon - Smooth muscle cells, Prostate - Smooth muscle cells, Spleen - Fibroblast_1, Thyroid gland - Smooth muscle cells"	"Region enriched"	"Detected in many"	5	"cerebellum: 14.8"	"Region enhanced"	"Detected in many"		"spinal cord: 6.4"	HPA028811	Approved		Approved	"Nucleoplasm,Nuclear membrane,Plasma membrane,Primary cilium transition zone"			NA	NA				"Cluster 41: Smooth muscle tissue - ECM organization"	"Cluster 35: Non-specific - DNA binding"	"Cluster 64: Connective tissue cells - ECM organization"	"Cluster 48: Smooth muscle cells - Signal transduction"		"Plasma membrane"	"Nucleoplasm, Nuclear membrane, Primary cilium transition zone"	"HPA028811: AB_10603875"	"unprognostic (2.06e-2)"	"unprognostic (2.68e-2)"	"unprognostic (6.83e-2)"	"unprognostic (3.06e-2)"	"unprognostic (8.22e-2)"	"unprognostic (1.04e-1)"	"unprognostic (3.68e-2)"	"unprognostic (8.10e-2)"	"unprognostic (8.21e-3)"	"unprognostic (1.65e-1)"	"unprognostic (1.99e-1)"	"unprognostic (1.86e-1)"	"unprognostic (2.96e-3)"	"unprognostic (2.41e-1)"	"potential prognostic favorable (5.99e-4)"	"unprognostic (1.57e-1)"	"unprognostic (3.63e-1)"	"unprognostic (2.80e-2)"	"unprognostic (9.05e-2)"	"unprognostic (7.16e-2)"	"unprognostic (1.13e-2)"	"unprognostic (2.78e-1)"	"unprognostic (8.17e-2)"	"unprognostic (7.65e-2)"	"unprognostic (7.11e-3)"	"unprognostic (3.24e-2)"	"unprognostic (1.71e-1)"	"unprognostic (1.54e-2)"	"unprognostic (9.94e-2)"	"unprognostic (1.47e-2)"	"unprognostic (2.48e-1)"
MRGPRG	"GPR169, mrgG"	ENSG00000182170	"MAS related GPR family member G"	Q86SM5	11	3217944-3218813	"G-protein coupled receptors, Predicted membrane proteins"		"G-protein coupled receptor, Receptor, Transducer"		"Evidence at transcript level"	"No human protein/transcript evidence"	"Evidence at transcript level"	"Evidence at transcript level"	"Not detected"	"Not detected"			"Not detected"	"Not detected"			"Not detected"	"Not detected"			"Not detected"	"Not detected"			"Not detected"	"Not detected"			"Not detected in immune cells"	"Not detected"			"Not detected"	"Not detected"			"Cancer enriched"	"Detected in single"	21	"breast cancer: 2.1"		"Not detected"	"Not detected"							HPA058909	Uncertain						NA	NA						"Cluster 70: DU4475 - Unknown function"					"HPA058909: AB_2683852"																															
MRGPRX1	MRGX1	ENSG00000170255	"MAS related GPR family member X1"	Q96LB2	11	18933499-18939414	"G-protein coupled receptors, Predicted membrane proteins"	"Acute phase"	"G-protein coupled receptor, Receptor, Transducer"		"Evidence at protein level"	"No human protein/transcript evidence"	"Evidence at protein level"	"Evidence at protein level"	"Not detected"	"Not detected"			"Not detected"	"Not detected"			"Not detected"	"Not detected"			"Not detected"	"Not detected"			"Not detected"	"Not detected"			"Not detected in immune cells"	"Not detected"			"Not detected"	"Not detected"			"Cancer enriched"	"Detected in some"	15	"Rhabdoid: 39.4"																	NA	NA						"Cluster 3: Rhabdoid - Membrane components"																																				
MRGPRX2	MRGX2	ENSG00000183695	"MAS related GPR family member X2"	Q96LB1	11	19054455-19060717	"G-protein coupled receptors, Predicted membrane proteins"		"G-protein coupled receptor, Receptor, Transducer"		"Evidence at protein level"	"Evidence at transcript level"	"Evidence at protein level"	"Evidence at protein level"	"Tissue enhanced"	"Detected in single"		"skin 1: 1.0"	"Group enriched"	"Detected in some"	5	"granulocytes: 6.7;Melanocytes: 1.7"	"Not detected"	"Not detected"			"Not detected"	"Not detected"			"Not detected"	"Not detected"			"Not detected in immune cells"	"Not detected"			"Not detected"	"Not detected"			"Not detected"	"Not detected"			"Adipose subcutaneous - Mast cells, Colon - Mast cells, Skin - Mast cells"									HPA055220	Approved						NA	NA				"Cluster 13: Skin - Cornification"		"Cluster 51: Myeloma - Immunoglobulins"	"Cluster 30: Granulocytes - Unknown function"				"HPA055220: AB_2682743"																															
MRGPRX3	MRGX3	ENSG00000179826	"MAS related GPR family member X3"	Q96LB0	11	18120955-18138488	"G-protein coupled receptors, Predicted membrane proteins"		"G-protein coupled receptor, Receptor, Transducer"		"Evidence at protein level"	"Evidence at transcript level"	"Evidence at protein level"	"Evidence at protein level"	"Tissue enhanced"	"Detected in single"		"salivary gland: 2.6"	"Cell type enriched"	"Detected in some"	18	"Basal respiratory cells: 48.1"	"Cell type enhanced"	"Detected in single"		"lower rhombic lip: 1.0"	"Cancer enhanced"	"Detected in some"		"Skin Cuteneous Melanoma (TCGA): 4.6"	"Low region specificity"	"Detected in all"			"Not detected in immune cells"	"Not detected"			"Not detected"	"Not detected"			"Cancer enriched"	"Detected in some"	5	"skin cancer: 11.9"																	NA	NA				"Cluster 38: Salivary gland - Salivary secretion"	"Cluster 48: Non-specific - Mixed function"	"Cluster 69: Skin cancer - ECM organization"	"Cluster 35: Respiratory epithelial cells - Unknown function"	1						"unprognostic (8.68e-2)"	"unprognostic (5.86e-2)"					"unprognostic (2.05e-1)"									"unprognostic (8.07e-3)"									"unprognostic (1.36e-2)"		"unprognostic (3.03e-1)"		
MRGPRX4	MRGX4	ENSG00000179817	"MAS related GPR family member X4"	Q96LA9	11	18172837-18174280	"G-protein coupled receptors, Predicted membrane proteins"		"G-protein coupled receptor, Receptor, Transducer"		"Evidence at protein level"	"No human protein/transcript evidence"	"Evidence at protein level"	"Evidence at transcript level"	"Not detected"	"Not detected"			"Not detected"	"Not detected"			"Not detected"	"Not detected"			"Not detected"	"Not detected"			"Not detected"	"Not detected"			"Not detected in immune cells"	"Not detected"			"Not detected"	"Not detected"			"Cancer enriched"	"Detected in single"	11	"skin cancer: 2.7"																	NA	NA						"Cluster 69: Skin cancer - ECM organization"	"Cluster 35: Respiratory epithelial cells - Unknown function"	4																																		
MTNR1A	MEL-1A-R	ENSG00000168412	"Melatonin receptor 1A"	P48039	4	186526792-186555567	"FDA approved drug targets, G-protein coupled receptors, Predicted membrane proteins, Transporters"		"G-protein coupled receptor, Receptor, Transducer"	"FDA approved drug targets"	"Evidence at protein level"	"Evidence at transcript level"	"Evidence at protein level"	"Evidence at protein level"	"Tissue enhanced"	"Detected in single"		"kidney: 1.8"	"Not detected"	"Not detected"			"Not detected"	"Not detected"			"Not detected"	"Not detected"			"Low region specificity"	"Detected in all"			"Not detected in immune cells"	"Not detected"			"Not detected"	"Not detected"			"Cancer enhanced"	"Detected in single"		"Bone cancer: 1.2"	"Kidney - Proximal tubular cells, Kidney - Proximal tubular cells, Testis - Early spermatids"	"Not detected"	"Not detected"			"Not detected"	"Not detected"										NA	NA				"Cluster 52: Kidney - Transmembrane transport"	"Cluster 10: Cerebellum - Nucleic acid binding"	"Cluster 12: Bone cancer - Neuronal signaling"	"Cluster 56: Proximal tubular cells - Amino acid metabolism"	26									"unprognostic (4.79e-2)"																				"unprognostic (4.87e-2)"					
MTNR1B		ENSG00000134640	"Melatonin receptor 1B"	P49286	11	92969651-92985066	"FDA approved drug targets, G-protein coupled receptors, Human disease related genes, Predicted intracellular proteins, Predicted membrane proteins"		"G-protein coupled receptor, Receptor, Transducer"	"FDA approved drug targets"	"Evidence at protein level"	"Evidence at protein level"	"Evidence at protein level"	"Evidence at protein level"	"Tissue enhanced"	"Detected in single"		"placenta: 1.0"	"Cell type enhanced"	"Detected in single"		"Granulosa cells: 1.2"	"Cell type enhanced"	"Detected in some"		"ependymal cell: 3.5;medium spiny neuron: 2.1;midbrain-derived inhibitory: 5.3"	"Cancer enhanced"	"Detected in single"		"Liver Hepatocellular Carcinoma (TCGA): 1.5"	"Low region specificity"	"Detected in many"			"Not detected in immune cells"	"Not detected"			"Not detected"	"Not detected"			"Cancer enhanced"	"Detected in some"		"Rhabdoid: 3.8;testis cancer: 1.2"	"Testis - Early spermatids"	"Not detected"	"Not detected"			"Low region specificity"	"Detected in some"			HPA074024	Supported						NA	NA				"Cluster 34: Non-specific - Mixed function"	"Cluster 33: Neurons - Mixed function"	"Cluster 5: Rhabdoid - Unknown function"	"Cluster 27: Syncytiotrophoblasts - Pregnancy"	7			"HPA074024: "														"unprognostic (2.68e-2)"	"unprognostic (1.48e-1)"																
NMBR	"BB1, BB1R, BRS1"	ENSG00000135577	"Neuromedin B receptor"	P28336	6	142058330-142147122	"G-protein coupled receptors, Plasma proteins, Predicted membrane proteins"		"G-protein coupled receptor, Receptor, Transducer"		"Evidence at protein level"	"Evidence at protein level"	"Evidence at protein level"	"Evidence at protein level"	"Not detected"	"Not detected"			"Cell type enhanced"	"Detected in some"		"Astrocytes: 3.1;Early spermatids: 8.9;Excitatory neurons: 2.3;Inhibitory neurons: 4.3;Oligodendrocyte precursor cells: 1.9;Oligodendrocytes: 2.4;Spermatocytes: 2.7"	"Cell type enhanced"	"Detected in many"		"eccentric medium spiny neuron: 30.8"	"Not detected"	"Not detected"			"Low region specificity"	"Detected in many"			"Not detected in immune cells"	"Not detected"			"Not detected"	"Not detected"			"Not detected"	"Not detected"			"Testis - Early spermatids"	"Low region specificity"	"Detected in all"			"Low region specificity"	"Detected in many"			HPA026665			Supported	"Plasma membrane,Cytosol"			NA	NA					"Cluster 41: Monoamines - Neurotransmitter signalling"	"Cluster 11: Neuronal - Sensory perception"	"Cluster 69: Neurons - Neuronal signaling"		"Plasma membrane, Cytosol"		"HPA026665: AB_1854527"								"unprognostic (2.53e-1)"																							
NMUR1	"FM-3, GPC-R, GPR66, NMU1R"	ENSG00000171596	"Neuromedin U receptor 1"	Q9HB89	2	231523187-231530445	"G-protein coupled receptors, Predicted membrane proteins, Transporters"		"G-protein coupled receptor, Receptor, Transducer"		"Evidence at protein level"	"Evidence at transcript level"	"Evidence at protein level"	"Evidence at transcript level"	"Tissue enhanced"	"Detected in many"		"retina: 7.9"	"Cell type enhanced"	"Detected in some"		"NK-cells: 32.1;Peritubular cells: 7.6;Rod photoreceptor cells: 17.5;T-cells: 6.5"	"Cell type enriched"	"Detected in some"	9	"leukocyte: 18.5"	"Low cancer specificity"	"Detected in some"			"Low region specificity"	"Detected in all"			"Group enriched"	"Detected in many"	7	"gdT-cell: 18.0;MAIT T-cell: 4.5;memory CD8 T-cell: 8.7;naive CD8 T-cell: 5.1;NK-cell: 10.9"	"Group enriched"	"Detected in many"	23	"NK-cells: 10.9;T-cells: 18.0"	"Cancer enhanced"	"Detected in single"		"Leukemia: 1.7"	"Adrenal gland - Fibroblasts, Stomach - Fibroblasts, Thyroid gland - Fibroblasts"	"Low region specificity"	"Detected in single"			"Low region specificity"	"Detected in many"			HPA027895	Approved						NA	NA			"Cluster 15: NK-cells - Unknown function"	"Cluster 39: Retina & Testis - Cilium"	"Cluster 10: Cerebellum - Nucleic acid binding"	"Cluster 14: Myeloid leukemia - Innate immune response"	"Cluster 19: NK-cells - Adaptive immune response"	1			"HPA027895: AB_10602713"			"unprognostic (9.83e-3)"			"unprognostic (2.48e-1)"					"unprognostic (4.45e-2)"	"unprognostic (1.11e-3)"														"unprognostic (1.55e-1)"		"unprognostic (2.10e-3)"	"unprognostic (1.72e-1)"		
NMUR2	NMU2R	ENSG00000132911	"Neuromedin U receptor 2"	Q9GZQ4	5	152391546-152433368	"G-protein coupled receptors, Predicted membrane proteins"		"G-protein coupled receptor, Receptor, Transducer"		"Evidence at protein level"	"Evidence at protein level"	"Evidence at protein level"	"Evidence at protein level"	"Tissue enhanced"	"Detected in some"		"stomach 1: 1.0;testis: 1.5"	"Group enriched"	"Detected in some"	7	"Gastric mucus-secreting cells: 3.5;Oligodendrocytes: 7.9;Sertoli cells: 2.7"	"Cell type enhanced"	"Detected in some"		"endothelial cell: 10.0;oligodendrocyte: 28.6"	"Group enriched"	"Detected in some"	5	"Pancreatic Adenocarcinoma (TCGA): 3.2;Stomach Adenocarcinoma (TCGA): 3.8"	"Low region specificity"	"Detected in many"			"Not detected in immune cells"	"Not detected"			"Not detected"	"Not detected"			"Cancer enhanced"	"Detected in some"		"Gastric cancer: 4.5;pancreatic cancer: 8.1"	"Testis - Sertoli cells"	"Region enhanced"	"Detected in single"		"hypothalamus: 1.7"	"Low region specificity"	"Detected in all"			"HPA027800, HPA045836"	Enhanced		Supported	"Plasma membrane"			NA	NA				"Cluster 44: Testis - Spermatogenesis"	"Cluster 26: Oligodendrocytes - Mixed function"	"Cluster 53: Squamous epithelial cells - Keratinization"	"Cluster 51: Oligodendrocytes - Unknown function"	4	"Plasma membrane"		"HPA027800: , HPA045836: AB_10968856"						"unprognostic (3.24e-2)"																"unprognostic (3.92e-2)"	"unprognostic (1.78e-1)"			"unprognostic (3.62e-2)"		"unprognostic (1.64e-2)"			
NPBWR1	GPR7	ENSG00000288611	"Neuropeptides B and W receptor 1"	P48145	8	52939182-52943734	"G-protein coupled receptors, Predicted membrane proteins"		"G-protein coupled receptor, Receptor, Transducer"		"Evidence at protein level"	"Evidence at transcript level"	"Evidence at protein level"	"Evidence at protein level"	"Tissue enhanced"	"Detected in some"		"brain: 1.0;liver: 2.0"	"Cell type enhanced"	"Detected in some"		"Cholangiocytes: 1.9;Hepatocytes: 1.2"	"Cell type enhanced"	"Detected in some"		"CGE interneuron: 7.1;thalamic excitatory: 6.8;upper-layer intratelencephalic: 4.2"	"Cancer enhanced"	"Detected in some"		"Lung Squamous Cell Carcinoma (TCGA): 2.2"	"Low region specificity"	"Detected in many"			"Not detected in immune cells"	"Not detected"			"Not detected"	"Not detected"			"Low cancer specificity"	"Detected in some"				"Low region specificity"	"Detected in some"			"Region enhanced"	"Detected in many"		"cerebral cortex: 11.0"								NA	NA					"Cluster 14: Neurons - Synaptic function"	"Cluster 53: Squamous epithelial cells - Keratinization"	"Cluster 62: Hepatocytes - Metabolism"	1							"unprognostic (1.81e-1)"					"unprognostic (1.72e-2)"									"unprognostic (1.59e-1)"	"unprognostic (1.61e-1)"										"unprognostic (2.76e-1)"		
NPBWR2	GPR8	ENSG00000125522	"Neuropeptides B and W receptor 2"	P48146	20	64103802-64107565	"G-protein coupled receptors, Predicted membrane proteins, Transporters"		"G-protein coupled receptor, Receptor, Transducer"		"Evidence at protein level"	"Evidence at transcript level"	"Evidence at protein level"	"Evidence at protein level"	"Not detected"	"Not detected"			"Not detected"	"Not detected"			"Not detected"	"Not detected"			"Not detected"	"Not detected"			"Group enriched"	"Detected in some"	6	"cerebral cortex: 5.8;white matter: 2.9"	"Not detected in immune cells"	"Not detected"			"Not detected"	"Not detected"			"Not detected"	"Not detected"			"Adrenal gland - Adrenal medulla cells"					"Region enhanced"	"Detected in single"		"olfactory bulb: 1.1"								NA	NA					"Cluster 53: Neurons - Mixed function"	"Cluster 53: Squamous epithelial cells - Keratinization"	"Cluster 73: B-cells - B-cell function"	15																																		
NPFFR1	"GPR147, NPFF1R1, OT7T022"	ENSG00000148734	"Neuropeptide FF receptor 1"	Q9GZQ6	10	70247329-70284004	"G-protein coupled receptors, Predicted membrane proteins"		"G-protein coupled receptor, Receptor, Transducer"		"Evidence at protein level"	"Evidence at transcript level"	"Evidence at protein level"	"Evidence at protein level"	"Group enriched"	"Detected in some"	4	"brain: 5.8;retina: 3.0"	"Cell type enhanced"	"Detected in some"		"Astrocytes: 6.2;Granulosa cells: 3.5;Muller glia cells: 8.6"	"Cell type enhanced"	"Detected in many"		"bergmann glia: 50.5;mammillary body: 34.1"	"Low cancer specificity"	"Detected in some"			"Low region specificity"	"Detected in all"			"Not detected in immune cells"	"Not detected"			"Not detected"	"Not detected"			"Not detected"	"Not detected"			"Adipose visceral - Mesothelial cells, Lung - Alveolar cells type 2, Testis - Sertoli cells"	"Group enriched"	"Detected in many"	5	"basal ganglia: 15.7;hypothalamus: 6.3"	"Low region specificity"	"Detected in some"			HPA037521	Uncertain						NA	NA				"Cluster 28: Neuronal - Transcription"	"Cluster 25: Non-specific - Transcription"	"Cluster 32: Non-specific - Cell proliferation"	"Cluster 10: Muller glia cells - Visual perception"	2			"HPA037521: AB_2675520"						"unprognostic (6.51e-2)"														"unprognostic (2.88e-1)"						"unprognostic (4.17e-3)"					"unprognostic (1.70e-1)"
NPFFR2	"GPR74, NPFF2, NPGPR"	ENSG00000056291	"Neuropeptide FF receptor 2"	Q9Y5X5	4	72031902-72148305	"G-protein coupled receptors, Predicted membrane proteins"		"G-protein coupled receptor, Receptor, Transducer"		"Evidence at protein level"	"Evidence at transcript level"	"Evidence at protein level"	"Evidence at protein level"	"Tissue enhanced"	"Detected in some"		"lymphoid tissue: 7.0;seminal vesicle: 3.1"	"Cell type enhanced"	"Detected in some"		"Breast glandular cells: 21.8;Cytotrophoblasts: 6.8;Excitatory neurons: 13.9;Extravillous trophoblasts: 13.7;Oocytes: 8.8;Syncytiotrophoblasts: 10.3"	"Cell type enriched"	"Detected in many"	4	"eccentric medium spiny neuron: 296.7"	"Low cancer specificity"	"Detected in some"			"Low region specificity"	"Detected in many"			"Not detected in immune cells"	"Not detected"			"Not detected"	"Not detected"			"Cancer enhanced"	"Detected in many"		"Rhabdoid: 14.7"		"Region enriched"	"Detected in some"	4	"olfactory bulb: 4.3"	"Low region specificity"	"Detected in all"			HPA026825			Approved	"Plasma membrane,Actin filaments"			NA	NA				"Cluster 71: Thymus - Adaptive immune response"	"Cluster 14: Neurons - Synaptic function"	"Cluster 3: Rhabdoid - Membrane components"	"Cluster 17: Breast glandular cells - Lactation"		"Plasma membrane"	"Actin filaments"	"HPA026825: AB_10603123"	"unprognostic (5.14e-3)"		"unprognostic (2.47e-1)"												"unprognostic (2.11e-2)"														"unprognostic (1.34e-1)"		
NPSR1	"GPR154, GPRA, PGR14"	ENSG00000187258	"Neuropeptide S receptor 1"	Q6W5P4	7	34658218-34878332	"Disease related genes, G-protein coupled receptors, Human disease related genes, Potential drug targets, Predicted membrane proteins, Transporters"		"G-protein coupled receptor, Receptor, Transducer"	Asthma	"Evidence at protein level"	"Evidence at transcript level"	"Evidence at protein level"	"Evidence at protein level"	"Not detected"	"Not detected"			"Cell type enhanced"	"Detected in some"		"Early spermatids: 3.0;Excitatory neurons: 3.6;Inhibitory neurons: 2.1;Late spermatids: 3.8"	"Cell type enhanced"	"Detected in many"		"deep-layer near-projecting: 164.6;mammillary body: 130.5;midbrain-derived inhibitory: 306.9"	"Group enriched"	"Detected in some"	4	"Colon Adenocarcinoma (TCGA): 5.7;Lung Squamous Cell Carcinoma (TCGA): 2.3;Pancreatic Adenocarcinoma (TCGA): 5.4;Rectum Adenocarcinoma (TCGA): 4.5;Stomach Adenocarcinoma (TCGA): 7.4"	"Low region specificity"	"Detected in many"			"Not detected in immune cells"	"Not detected"			"Not detected"	"Not detected"			"Group enriched"	"Detected in some"	9	"Bile duct cancer: 5.5;colorectal cancer: 7.6;Gastric cancer: 9.9;pancreatic cancer: 2.7"	"Testis - Late spermatids"	"Low region specificity"	"Detected in many"			"Low region specificity"	"Detected in all"										NA	NA					"Cluster 19: Astrocytes - Mixed function"	"Cluster 57: Stomach & Colon cancer - Digestion"	"Cluster 69: Neurons - Neuronal signaling"									"unprognostic (1.05e-1)"	"unprognostic (1.89e-2)"		"unprognostic (8.16e-2)"										"unprognostic (1.84e-1)"				"unprognostic (1.41e-2)"	"unprognostic (8.43e-2)"		"unprognostic (1.82e-1)"	"unprognostic (3.94e-1)"		"unprognostic (2.02e-1)"	"unprognostic (4.93e-2)"		
