Gene	"Gene synonym"	Ensembl	"Gene description"	Uniprot	Chromosome	Position	"Protein class"	"Biological process"	"Molecular function"	"Disease involvement"	Evidence	"HPA evidence"	"UniProt evidence"	"NeXtProt evidence"	"MS evidence"	"RNA tissue specificity"	"RNA tissue distribution"	"RNA tissue specificity score"	"RNA tissue specific NX"	"RNA single cell type specificity"	"RNA single cell type distribution"	"RNA single cell type specificity score"	"RNA single cell type specific NX"	"RNA cancer specificity"	"RNA cancer distribution"	"RNA cancer specificity score"	"RNA cancer specific FPKM"	"RNA brain regional specificity"	"RNA brain regional distribution"	"RNA brain regional specificity score"	"RNA brain regional specific NX"	"RNA blood cell specificity"	"RNA blood cell distribution"	"RNA blood cell specificity score"	"RNA blood cell specific NX"	"RNA blood lineage specificity"	"RNA blood lineage distribution"	"RNA blood lineage specificity score"	"RNA blood lineage specific NX"	"RNA cell line specificity"	"RNA cell line distribution"	"RNA cell line specificity score"	"RNA cell line specific NX"	"RNA mouse brain regional specificity"	"RNA mouse brain regional distribution"	"RNA mouse brain regional specificity score"	"RNA mouse brain regional specific pTPM"	"RNA pig brain regional specificity"	"RNA pig brain regional distribution"	"RNA pig brain regional specificity score"	"RNA pig brain regional specific pTPM"	Antibody	"Reliability (IH)"	"Reliability (Mouse Brain)"	"Reliability (IF)"	"Subcellular location"	"Secretome location"	"CCD Protein"	"CCD Transcript"	"Blood concentration - Conc. blood IM [pg/L]"	"Blood concentration - Conc. blood MS [pg/L]"	"Subcellular main location"	"Subcellular additional location"	"Antibody RRID"	"Pathology prognostics - Breast cancer"	"Pathology prognostics - Cervical cancer"	"Pathology prognostics - Colorectal cancer"	"Pathology prognostics - Endometrial cancer"	"Pathology prognostics - Glioma"	"Pathology prognostics - Head and neck cancer"	"Pathology prognostics - Liver cancer"	"Pathology prognostics - Lung cancer"	"Pathology prognostics - Melanoma"	"Pathology prognostics - Ovarian cancer"	"Pathology prognostics - Pancreatic cancer"	"Pathology prognostics - Prostate cancer"	"Pathology prognostics - Renal cancer"	"Pathology prognostics - Stomach cancer"	"Pathology prognostics - Testis cancer"	"Pathology prognostics - Thyroid cancer"	"Pathology prognostics - Urothelial cancer"	"Tissue RNA - adipose tissue [NX]"	"Tissue RNA - adrenal gland [NX]"	"Tissue RNA - amygdala [NX]"	"Tissue RNA - appendix [NX]"	"Tissue RNA - basal ganglia [NX]"	"Tissue RNA - bone marrow [NX]"	"Tissue RNA - breast [NX]"	"Tissue RNA - cerebellum [NX]"	"Tissue RNA - cerebral cortex [NX]"	"Tissue RNA - cervix, uterine [NX]"	"Tissue RNA - colon [NX]"	"Tissue RNA - corpus callosum [NX]"	"Tissue RNA - ductus deferens [NX]"	"Tissue RNA - duodenum [NX]"	"Tissue RNA - endometrium 1 [NX]"	"Tissue RNA - epididymis [NX]"	"Tissue RNA - esophagus [NX]"	"Tissue RNA - fallopian tube [NX]"	"Tissue RNA - gallbladder [NX]"	"Tissue RNA - heart muscle [NX]"	"Tissue RNA - hippocampal formation [NX]"	"Tissue RNA - hypothalamus [NX]"	"Tissue RNA - kidney [NX]"	"Tissue RNA - liver [NX]"	"Tissue RNA - lung [NX]"	"Tissue RNA - lymph node [NX]"	"Tissue RNA - midbrain [NX]"	"Tissue RNA - olfactory region [NX]"	"Tissue RNA - ovary [NX]"	"Tissue RNA - pancreas [NX]"	"Tissue RNA - parathyroid gland [NX]"	"Tissue RNA - pituitary gland [NX]"	"Tissue RNA - placenta [NX]"	"Tissue RNA - pons and medulla [NX]"	"Tissue RNA - prostate [NX]"	"Tissue RNA - rectum [NX]"	"Tissue RNA - retina [NX]"	"Tissue RNA - salivary gland [NX]"	"Tissue RNA - seminal vesicle [NX]"	"Tissue RNA - skeletal muscle [NX]"	"Tissue RNA - skin 1 [NX]"	"Tissue RNA - small intestine [NX]"	"Tissue RNA - smooth muscle [NX]"	"Tissue RNA - spinal cord [NX]"	"Tissue RNA - spleen [NX]"	"Tissue RNA - stomach 1 [NX]"	"Tissue RNA - testis [NX]"	"Tissue RNA - thalamus [NX]"	"Tissue RNA - thymus [NX]"	"Tissue RNA - thyroid gland [NX]"	"Tissue RNA - tongue [NX]"	"Tissue RNA - tonsil [NX]"	"Tissue RNA - urinary bladder [NX]"	"Tissue RNA - vagina [NX]"	"Tissue RNA - B-cells [NX]"	"Tissue RNA - dendritic cells [NX]"	"Tissue RNA - granulocytes [NX]"	"Tissue RNA - monocytes [NX]"	"Tissue RNA - NK-cells [NX]"	"Tissue RNA - T-cells [NX]"	"Tissue RNA - total PBMC [NX]"	"Cell RNA - A-431 [NX]"	"Cell RNA - A549 [NX]"	"Cell RNA - AF22 [NX]"	"Cell RNA - AN3-CA [NX]"	"Cell RNA - ASC diff [NX]"	"Cell RNA - ASC TERT1 [NX]"	"Cell RNA - BEWO [NX]"	"Cell RNA - BJ [NX]"	"Cell RNA - BJ hTERT+ [NX]"	"Cell RNA - BJ hTERT+ SV40 Large T+ [NX]"	"Cell RNA - BJ hTERT+ SV40 Large T+ RasG12V [NX]"	"Cell RNA - CACO-2 [NX]"	"Cell RNA - CAPAN-2 [NX]"	"Cell RNA - Daudi [NX]"	"Cell RNA - EFO-21 [NX]"	"Cell RNA - fHDF/TERT166 [NX]"	"Cell RNA - GAMG [NX]"	"Cell RNA - HaCaT [NX]"	"Cell RNA - HAP1 [NX]"	"Cell RNA - HBEC3-KT [NX]"	"Cell RNA - HBF TERT88 [NX]"	"Cell RNA - HDLM-2 [NX]"	"Cell RNA - HEK 293 [NX]"	"Cell RNA - HEL [NX]"	"Cell RNA - HeLa [NX]"	"Cell RNA - Hep G2 [NX]"	"Cell RNA - HHSteC [NX]"	"Cell RNA - HL-60 [NX]"	"Cell RNA - HMC-1 [NX]"	"Cell RNA - HSkMC [NX]"	"Cell RNA - hTCEpi [NX]"	"Cell RNA - hTEC/SVTERT24-B [NX]"	"Cell RNA - hTERT-HME1 [NX]"	"Cell RNA - hTERT-RPE1 [NX]"	"Cell RNA - HUVEC TERT2 [NX]"	"Cell RNA - JURKAT [NX]"	"Cell RNA - K-562 [NX]"	"Cell RNA - Karpas-707 [NX]"	"Cell RNA - LHCN-M2 [NX]"	"Cell RNA - MCF7 [NX]"	"Cell RNA - MOLT-4 [NX]"	"Cell RNA - NB-4 [NX]"	"Cell RNA - NTERA-2 [NX]"	"Cell RNA - OE19 [NX]"	"Cell RNA - PC-3 [NX]"	"Cell RNA - REH [NX]"	"Cell RNA - RH-30 [NX]"	"Cell RNA - RPMI-8226 [NX]"	"Cell RNA - RPTEC TERT1 [NX]"	"Cell RNA - RT4 [NX]"	"Cell RNA - SCLC-21H [NX]"	"Cell RNA - SH-SY5Y [NX]"	"Cell RNA - SiHa [NX]"	"Cell RNA - SK-BR-3 [NX]"	"Cell RNA - SK-MEL-30 [NX]"	"Cell RNA - SuSa [NX]"	"Cell RNA - T-47d [NX]"	"Cell RNA - THP-1 [NX]"	"Cell RNA - TIME [NX]"	"Cell RNA - U-138 MG [NX]"	"Cell RNA - U-2 OS [NX]"	"Cell RNA - U-2197 [NX]"	"Cell RNA - U-251 MG [NX]"	"Cell RNA - U-266/70 [NX]"	"Cell RNA - U-266/84 [NX]"	"Cell RNA - U-698 [NX]"	"Cell RNA - U-87 MG [NX]"	"Cell RNA - U-937 [NX]"	"Cell RNA - WM-115 [NX]"	"Blood RNA - basophil [NX]"	"Blood RNA - classical monocyte [NX]"	"Blood RNA - eosinophil [NX]"	"Blood RNA - gdT-cell [NX]"	"Blood RNA - intermediate monocyte [NX]"	"Blood RNA - MAIT T-cell [NX]"	"Blood RNA - memory B-cell [NX]"	"Blood RNA - memory CD4 T-cell [NX]"	"Blood RNA - memory CD8 T-cell [NX]"	"Blood RNA - myeloid DC [NX]"	"Blood RNA - naive B-cell [NX]"	"Blood RNA - naive CD4 T-cell [NX]"	"Blood RNA - naive CD8 T-cell [NX]"	"Blood RNA - neutrophil [NX]"	"Blood RNA - NK-cell [NX]"	"Blood RNA - non-classical monocyte [NX]"	"Blood RNA - plasmacytoid DC [NX]"	"Blood RNA - T-reg [NX]"	"Blood RNA - total PBMC [NX]"	"Brain RNA - amygdala [NX]"	"Brain RNA - basal ganglia [NX]"	"Brain RNA - cerebellum [NX]"	"Brain RNA - cerebral cortex [NX]"	"Brain RNA - hippocampal formation [NX]"	"Brain RNA - hypothalamus [NX]"	"Brain RNA - midbrain [NX]"	"Brain RNA - olfactory region [NX]"	"Brain RNA - pons and medulla [NX]"	"Brain RNA - thalamus [NX]"	"Single Cell Type RNA - Alveolar cells type 1 [NX]"	"Single Cell Type RNA - Alveolar cells type 2 [NX]"	"Single Cell Type RNA - B-cells [NX]"	"Single Cell Type RNA - Basal glandular cells [NX]"	"Single Cell Type RNA - Basal keratinocytes [NX]"	"Single Cell Type RNA - Bipolar cells [NX]"	"Single Cell Type RNA - Cardiomyocytes [NX]"	"Single Cell Type RNA - Cholangiocytes [NX]"	"Single Cell Type RNA - Ciliated cells [NX]"	"Single Cell Type RNA - Club cells [NX]"	"Single Cell Type RNA - Collecting duct cells [NX]"	"Single Cell Type RNA - Cone photoreceptor cells [NX]"	"Single Cell Type RNA - Cytotrophoblasts [NX]"	"Single Cell Type RNA - Distal tubular cells [NX]"	"Single Cell Type RNA - Ductal cells [NX]"	"Single Cell Type RNA - Early spermatids [NX]"	"Single Cell Type RNA - Endothelial cells [NX]"	"Single Cell Type RNA - Enterocytes [NX]"	"Single Cell Type RNA - Erythroid cells [NX]"	"Single Cell Type RNA - Exocrine glandular cells [NX]"	"Single Cell Type RNA - Extravillous trophoblasts [NX]"	"Single Cell Type RNA - Fibroblasts [NX]"	"Single Cell Type RNA - Glandular cells [NX]"	"Single Cell Type RNA - granulocytes [NX]"	"Single Cell Type RNA - Hepatocytes [NX]"	"Single Cell Type RNA - Hofbauer cells [NX]"	"Single Cell Type RNA - Horizontal cells [NX]"	"Single Cell Type RNA - Intestinal endocrine cells [NX]"	"Single Cell Type RNA - Ito cells [NX]"	"Single Cell Type RNA - Kupffer cells [NX]"	"Single Cell Type RNA - Late spermatids [NX]"	"Single Cell Type RNA - Leydig cells [NX]"	"Single Cell Type RNA - Macrophages [NX]"	"Single Cell Type RNA - Melanocytes [NX]"	"Single Cell Type RNA - monocytes [NX]"	"Single Cell Type RNA - Mucus-secreting cells [NX]"	"Single Cell Type RNA - Muller glia cells [NX]"	"Single Cell Type RNA - Pancreatic endocrine cells [NX]"	"Single Cell Type RNA - Paneth cells [NX]"	"Single Cell Type RNA - Peritubular cells [NX]"	"Single Cell Type RNA - Proximal tubular cells [NX]"	"Single Cell Type RNA - Rod photoreceptor cells [NX]"	"Single Cell Type RNA - Sertoli cells [NX]"	"Single Cell Type RNA - Smooth muscle cells [NX]"	"Single Cell Type RNA - Spermatocytes [NX]"	"Single Cell Type RNA - Spermatogonia [NX]"	"Single Cell Type RNA - Suprabasal keratinocytes [NX]"	"Single Cell Type RNA - Syncytiotrophoblasts [NX]"	"Single Cell Type RNA - T-cells [NX]"	"Single Cell Type RNA - Undifferentiated cells [NX]"	"Single Cell Type RNA - Urothelial cells [NX]"
ACE	"ACE1, CD143, DCP1"	ENSG00000159640	"Angiotensin I converting enzyme"	P12821	17	63477061-63498380	"Candidate cardiovascular disease genes, CD markers, Disease related genes, Enzymes, FDA approved drug targets, Plasma proteins, Predicted intracellular proteins, Predicted membrane proteins, Predicted secreted proteins"		"Carboxypeptidase, Hydrolase, Metalloprotease, Protease"	"FDA approved drug targets"	"Evidence at protein level"	"Evidence at protein level"	"Evidence at protein level"	"Evidence at protein level"	"Evidence at protein level"	"Tissue enriched"	"Detected in many"	5	"intestine: 205.6"	"Group enriched"	"Detected in many"	25	"Early spermatids: 470.5;Late spermatids: 1015.1"	"Low cancer specificity"	"Detected in all"			"Low region specificity"	"Detected in some"			"Cell type enhanced"	"Detected in some"		"memory B-cell: 3.7"	"Group enriched"	"Detected in many"	23	"B-cells: 3.7;monocytes: 2.0;T-cells: 1.9"	"Group enriched"	"Detected in some"	4	"ASC TERT1: 36.7;HUVEC TERT2: 18.7"									"CAB002426, CAB002921, HPA029298, HPA069790"	Enhanced		Approved	Vesicles	"Secreted to blood"	NA	NA	104000000	92000000	Vesicles		"CAB002426: AB_442052, CAB002921: , HPA029298: AB_10960255, HPA069790: AB_2686197"	"unprognostic (4.72e-2)"	"unprognostic (4.16e-1)"	"unprognostic (1.93e-3)"	"unprognostic (6.06e-2)"	"unprognostic (2.78e-1)"	"unprognostic (1.35e-2)"	"unprognostic (4.37e-1)"	"unprognostic (1.54e-1)"	"unprognostic (1.56e-1)"	"unprognostic (1.25e-2)"	"unprognostic (3.13e-2)"	"unprognostic (2.38e-1)"	"unprognostic (7.66e-2)"	"unprognostic (9.07e-2)"	"unprognostic (1.66e-1)"	"unprognostic (1.08e-1)"	"unprognostic (2.76e-2)"	6.8	2.0	0.5	2.4	4.2	0.0	2.9	0.5	1.1	5.3	83.2	0.7	37.7	46.4	4.5	5.1	1.7	1.5	4.4	4.7	0.6	0.7	2.6	1.4	16.3	2.2	0.4	0.7	1.4	3.0	3.6	3.6	3.6	0.8	3.4	1.4	1.7	2.5	20.1	3.6	1.3	205.6	2.4	0.6	1.4	1.9	32.6	1.3	0.5	6.9	3.1	2.2	1.7	1.6	3.7	0.1	0.0	2.0	0.0	1.9	0.4	0.0	0.0	0.0	0.0	1.5	36.7	0.4	1.3	2.7	0.0	0.0	0.5	3.2	0.7	1.1	6.2	0.0	0.0	1.7	0.0	0.0	0.0	0.7	3.5	0.0	0.0	0.8	0.0	0.0	2.4	0.0	0.0	0.0	0.6	18.7	0.0	3.1	0.0	0.0	0.6	0.0	0.8	0.3	6.3	0.4	0.1	0.2	0.5	0.0	0.0	4.6	3.2	0.0	0.0	0.0	0.7	1.6	0.2	0.0	0.1	0.1	0.3	0.0	0.0	0.0	0.0	0.5	0.0	0.2	0.0	0.0	0.0	0.4	0.6	0.9	3.7	1.9	1.4	0.1	0.0	0.0	0.0	0.0	0.0	2.0	0.0	0.0	0.4	0.5	4.2	0.5	1.1	0.6	0.7	0.4	0.7	0.8	1.3	0.0	3.5	0.0	1.5	1.3	3.1	1.4	0.0	0.0	1.2	0.0	0.0	0.1	0.0	3.4	470.5	13.5	29.6	0.0	0.4	0.1	1.0	6.0	6.9	0.0	4.4	0.0	17.3	2.5	18.5	1015.1	4.0	5.1	3.3	0.0	8.7	1.9	0.7	10.2	2.5	10.7	1.0	0.0	0.9	8.1	3.4	0.1	0.1	0.9	8.6	2.1
ACE2		ENSG00000130234	"Angiotensin I converting enzyme 2"	Q9BYF1	X	15561033-15602148	"Enzymes, FDA approved drug targets, Predicted membrane proteins, Predicted secreted proteins"	"Host-virus interaction"	"Carboxypeptidase, Host cell receptor for virus entry, Hydrolase, Metalloprotease, Protease, Receptor"	"FDA approved drug targets"	"Evidence at protein level"	"Evidence at protein level"	"Evidence at protein level"	"Evidence at protein level"	"Evidence at protein level"	"Tissue enriched"	"Detected in many"	5	"intestine: 122.0"	"Cell type enhanced"	"Detected in many"	13	"Cholangiocytes: 61.1;Enterocytes: 38.8;Proximal tubular cells: 45.6;Sertoli cells: 19.4"	"Cancer enhanced"	"Detected in many"		"renal cancer: 26.9"	"Not detected"	"Not detected"			"Not detected"	"Not detected"			"Not detected"	"Not detected"			"Cell line enhanced"	"Detected in some"		"BEWO: 2.4;HaCaT: 4.1;Hep G2: 2.5;NB-4: 2.2;RPMI-8226: 2.1;RT4: 2.5;SH-SY5Y: 2.8;SuSa: 1.9"	"Low region specificity"	"Detected in all"			"Not detected"	"Not detected"			"HPA000288, CAB026174, CAB026213, CAB080024, CAB080025, CAB080027, CAB080028"	Enhanced				"Secreted to blood"	NA	NA		85000			"CAB026174: , CAB026213: , CAB080024: AB_10864415, CAB080025: AB_2809589, CAB080027: AB_2665870, CAB080028: AB_2665871, HPA000288: AB_1078160"	"unprognostic (1.40e-1)"	"unprognostic (7.26e-2)"	"unprognostic (2.76e-2)"	"unprognostic (5.71e-2)"	"unprognostic (2.51e-1)"	"unprognostic (5.26e-2)"	"prognostic favorable (4.21e-4)"	"unprognostic (2.34e-2)"	"unprognostic (6.74e-3)"	"unprognostic (2.54e-3)"	"unprognostic (1.00e-1)"	"unprognostic (1.74e-1)"	"prognostic favorable (2.12e-5)"	"unprognostic (1.94e-1)"	"unprognostic (9.62e-2)"	"unprognostic (2.11e-1)"	"unprognostic (7.10e-2)"	4.5	0.4	0.2	0.8	0.2	0.0	2.3	0.2	0.2	0.4	49.1	0.2	2.3	46.0	0.4	2.7	1.2	0.6	16.4	10.5	0.2	0.1	23.2	1.2	0.8	0.6	0.2	0.2	1.3	1.6	0.0	0.2	1.0	0.2	0.5	1.3	0.2	1.1	1.2	0.7	0.2	122.0	0.3	0.2	0.2	0.5	17.9	0.2	0.2	4.5	0.5	0.2	0.4	0.9	0.0	0.0	0.2	0.0	0.0	0.3	0.0	0.2	0.0	0.4	0.0	0.7	0.0	2.4	0.0	0.0	0.0	0.0	0.0	1.3	0.0	0.7	0.0	0.4	4.1	0.2	0.1	0.0	0.1	0.1	0.0	0.0	2.5	0.0	0.0	0.0	0.0	0.3	0.0	0.2	0.0	0.1	0.0	0.0	0.0	0.0	0.0	0.0	2.2	0.1	0.2	0.2	0.0	0.0	2.1	0.4	2.5	0.6	2.8	0.1	0.3	0.2	1.9	0.2	0.0	0.0	0.0	0.0	0.7	0.0	0.0	0.0	0.0	0.0	0.0	0.0	0.0	0.0	0.0	0.0	0.0	0.3	0.0	0.0	0.0	0.0	0.0	0.0	0.0	0.2	0.0	0.0	0.0	0.0	0.0	0.2	0.2	0.2	0.2	0.2	0.1	0.2	0.2	0.2	0.2	0.0	0.3	2.2	0.5	0.1	0.0	9.8	61.1	0.0	0.0	0.0	0.0	2.9	3.3	0.5	0.4	0.0	38.8	0.0	0.7	0.2	0.0	0.4	0.0	0.8	0.7	0.0	6.9	0.0	0.0	1.1	7.8	0.0	0.0	0.0	1.2	0.0	0.9	4.2	5.6	45.6	0.0	19.4	0.0	1.1	0.7	0.1	10.6	0.0	3.3	1.6
AMY2A	AMY2	ENSG00000243480	"Amylase, alpha 2A (pancreatic)"	P04746	1	103616811-103625780	"Enzymes, FDA approved drug targets, Predicted secreted proteins"	"Carbohydrate metabolism"	"Glycosidase, Hydrolase"	"FDA approved drug targets"	"Evidence at protein level"	"Evidence at protein level"	"Evidence at protein level"	"Evidence at protein level"	"Evidence at protein level"	"Tissue enriched"	"Detected in some"	31	"pancreas: 1849.4"	"Cell type enriched"	"Detected in some"	68	"Exocrine glandular cells: 849.6"	"Cancer enriched"	"Detected in single"	2010	"pancreatic cancer: 200.3"	"Not detected"	"Not detected"			"Not detected"	"Not detected"			"Not detected"	"Not detected"			"Cell line enhanced"	"Detected in some"		"THP-1: 1.0;U-2 OS: 1.3"									"HPA045394, HPA045399, CAB045960, HPA046980"	Enhanced				"Secreted to digestive system"	NA	NA		77000000			"CAB045960: AB_2226891, HPA045394: AB_2679311, HPA045399: AB_2679313, HPA046980: AB_2679889"					"unprognostic (3.27e-1)"					"unprognostic (1.78e-3)"	"unprognostic (3.24e-2)"			"unprognostic (1.29e-1)"		"unprognostic (2.13e-2)"		0.2	0.0	0.2	0.2	0.2	0.0	0.2	0.2	0.2	0.2	0.2	0.2	0.2	0.1	0.2	0.2	0.2	0.0	0.2	0.2	0.2	0.0	0.2	0.2	0.2	0.2	0.2	0.2	0.9	1849.4	0.0	0.2	0.2	0.2	0.2	0.0	0.2	59.9	0.2	0.2	0.0	0.2	0.2	0.2	0.2	0.0	0.2	0.2	0.2	0.2	0.2	0.2	0.2	0.2	0.0	0.2	0.2	0.3	0.0	0.1	0.2	0.1	0.0	0.0	0.0	0.0	0.0	0.0	0.0	0.0	0.0	0.0	0.0	0.0	0.0	0.6	0.0	0.0	0.0	0.0	0.0	0.0	0.0	0.0	0.0	0.0	0.4	0.0	0.0	0.0	0.0	0.0	0.0	0.0	0.0	0.0	0.0	0.0	0.0	0.0	0.0	0.0	0.0	0.0	0.0	0.0	0.0	0.0	0.2	0.4	0.0	0.1	0.0	0.0	0.0	0.0	0.0	0.0	1.0	0.0	0.0	1.3	0.0	0.0	0.0	0.0	0.0	0.0	0.9	0.0	0.2	0.3	0.0	0.1	0.0	0.1	0.0	0.0	0.0	0.1	0.0	0.0	0.1	0.2	0.0	0.0	0.2	0.0	0.2	0.2	0.2	0.2	0.2	0.2	0.0	0.2	0.2	0.2	0.2	0.0	0.0	0.0	0.7	0.0	0.0	0.8	0.0	1.4	0.0	0.0	0.0	0.0	0.0	0.9	1.5	0.0	0.0	0.0	849.6	0.0	0.0	0.1	0.0	0.0	0.0	0.0	0.0	0.0	0.0	0.0	0.0	0.0	0.0	8.2	0.0	0.0	12.4	0.0	0.0	0.0	0.0	0.0	0.0	0.2	0.1	0.0	0.0	0.0	0.0	0.4
ANXA1	"ANX1, LPC1"	ENSG00000135046	"Annexin A1"	P04083	9	73151757-73170393	"Cancer-related genes, FDA approved drug targets, Plasma proteins, Predicted intracellular proteins, Predicted secreted proteins, Transporters"	"Adaptive immunity, Immunity, Inflammatory response, Innate immunity"	"Phospholipase A2 inhibitor"	"Cancer-related genes, FDA approved drug targets"	"Evidence at protein level"	"Evidence at protein level"	"Evidence at protein level"	"Evidence at protein level"	"Evidence at protein level"	"Tissue enhanced"	"Detected in many"		"esophagus: 432.6;tongue: 235.4"	"Cell type enhanced"	"Detected in many"	10	"granulocytes: 2387.0;Syncytiotrophoblasts: 5914.0;Urothelial cells: 4139.3"	"Low cancer specificity"	"Detected in all"			"Low region specificity"	"Detected in many"			"Low cell type specificity"	"Detected in many"			"Low lineage specificity"	"Detected in many"			"Low cell line specificity"	"Detected in many"			"Low region specificity"	"Detected in many"			"Low region specificity"	"Detected in all"			"HPA011271, HPA011272, CAB013023, CAB035987, CAB058693"	Enhanced		Enhanced	"Nucleoplasm,Plasma membrane,Cytosol"	"Secreted to blood"	NA	Yes		77000000	"Plasma membrane, Cytosol"	Nucleoplasm	"CAB013023: AB_2533983, CAB035987: , CAB058693: AB_2665585, HPA011271: AB_1844883, HPA011272: AB_1844884"	"unprognostic (2.53e-2)"	"unprognostic (1.31e-1)"	"unprognostic (9.08e-2)"	"prognostic favorable (5.71e-5)"	"unprognostic (1.53e-2)"	"unprognostic (4.28e-2)"	"unprognostic (1.82e-2)"	"unprognostic (1.30e-2)"	"unprognostic (1.30e-1)"	"unprognostic (1.14e-1)"	"unprognostic (2.54e-3)"	"unprognostic (1.47e-1)"	"unprognostic (9.82e-3)"	"unprognostic (1.13e-1)"	"unprognostic (8.55e-2)"	"prognostic favorable (4.57e-5)"	"prognostic unfavorable (6.19e-6)"	52.7	3.5	2.7	11.5	3.3	81.4	45.9	0.9	2.5	61.5	8.5	3.6	5.5	2.4	6.9	11.2	432.6	11.9	14.9	8.9	3.2	2.5	9.1	2.1	37.3	7.6	4.3	1.9	11.7	2.4	0.5	6.3	149.5	13.5	12.9	4.4	6.4	93.0	7.2	7.9	11.6	6.4	12.3	6.5	5.9	5.9	5.6	3.1	3.9	21.7	235.4	153.3	18.0	83.1	0.7	98.9	146.2	79.1	27.3	52.5	102.8	66.2	104.7	4.7	4.9	66.8	63.6	0.3	114.8	71.8	47.5	32.2	3.0	59.9	0.1	38.0	100.1	105.0	81.6	10.1	69.5	37.7	37.5	0.7	5.1	31.1	0.1	53.3	11.0	2.5	36.6	57.6	48.0	94.4	44.0	67.3	6.0	21.0	2.8	58.5	0.2	19.5	6.0	5.9	26.5	42.6	0.0	26.7	0.2	106.8	14.0	0.0	0.0	39.5	1.0	26.5	65.5	0.2	1.7	83.1	55.7	35.1	76.5	58.9	0.4	0.1	0.2	128.7	10.3	83.8	146.2	79.1	141.1	52.2	21.5	52.5	0.7	47.0	45.9	98.9	0.2	13.7	25.4	8.6	27.3	19.3	3.5	8.3	102.8	2.7	3.3	0.9	2.5	3.2	2.5	4.3	1.9	13.5	3.1	541.9	512.9	7.3	2232.0	752.1	0.0	11.9	17.8	1060.0	889.5	59.3	0.0	1215.0	0.0	156.6	6.3	398.1	0.8	0.0	20.0	1352.9	735.1	1709.3	2387.0	2.5	570.9	0.0	5.1	113.5	449.6	2.3	206.0	1058.5	291.8	475.3	1.8	0.2	431.7	0.0	8.9	3.1	0.0	64.7	275.6	0.7	2.9	522.6	5914.0	282.4	0.5	4139.3
AOC3	"HPAO, VAP-1, VAP1"	ENSG00000131471	"Amine oxidase, copper containing 3"	Q16853	17	42851184-42858130	"Cancer-related genes, Enzymes, FDA approved drug targets, Plasma proteins, Predicted intracellular proteins, Predicted secreted proteins"	"Cell adhesion"	Oxidoreductase	"Cancer-related genes, FDA approved drug targets"	"Evidence at protein level"	"Evidence at protein level"	"Evidence at protein level"	"Evidence at protein level"	"Evidence at protein level"	"Low tissue specificity"	"Detected in many"			"Cell type enhanced"	"Detected in many"	19	"Peritubular cells: 70.4;Sertoli cells: 116.4;Smooth muscle cells: 56.5"	"Low cancer specificity"	"Detected in all"			"Low region specificity"	"Detected in many"			"Cell type enriched"	"Detected in single"	13	"neutrophil: 1.2"	"Lineage enriched"	"Detected in single"	13	"granulocytes: 1.2"	"Cell line enriched"	"Detected in some"	18	"ASC diff: 85.5"	"Low region specificity"	"Detected in many"							"HPA000980, CAB025797"	Enhanced		Approved	"Golgi apparatus,Cytosol"	"Secreted - unknown location"	NA	NA		240000000	Cytosol	"Golgi apparatus"	"CAB025797: , HPA000980: AB_1078170"	"unprognostic (2.20e-1)"	"unprognostic (4.49e-2)"	"prognostic unfavorable (3.68e-4)"	"unprognostic (2.97e-2)"	"unprognostic (1.17e-1)"	"unprognostic (2.64e-1)"	"unprognostic (2.22e-1)"	"unprognostic (2.15e-2)"	"unprognostic (1.48e-1)"	"unprognostic (4.00e-2)"	"unprognostic (2.95e-1)"	"unprognostic (9.02e-2)"	"prognostic unfavorable (1.79e-5)"	"unprognostic (5.61e-2)"	"unprognostic (1.67e-1)"	"unprognostic (8.39e-2)"	"prognostic unfavorable (6.98e-4)"	97.0	11.5	0.4	18.7	1.0	0.0	67.7	0.5	1.3	26.9	44.3	1.0	16.3	3.6	44.7	34.8	36.1	18.5	50.9	12.1	0.4	0.4	5.8	8.3	48.0	7.9	0.5	1.2	23.8	2.4	2.2	1.3	10.8	2.0	36.5	9.4	32.1	8.0	24.7	7.7	5.5	15.0	79.2	0.6	7.5	17.7	16.2	0.3	1.0	6.6	11.6	2.6	75.9	20.9	0.0	0.0	1.2	0.0	0.0	0.0	0.0	0.0	0.4	0.0	0.2	85.5	0.1	1.3	0.0	0.0	0.0	0.2	0.2	0.0	0.1	0.2	0.0	0.0	0.1	0.2	0.0	0.2	0.3	1.5	0.1	0.1	4.7	0.2	0.0	0.2	0.9	0.2	0.1	0.2	0.0	0.0	0.5	0.0	0.4	0.1	0.0	0.0	0.3	0.1	0.0	0.1	0.2	0.2	0.7	0.0	0.5	0.0	0.1	0.0	0.0	0.5	0.6	0.0	0.0	0.0	0.0	0.7	0.3	0.1	1.2	1.4	0.1	0.1	0.5	0.0	0.0	0.0	0.0	0.0	0.0	0.0	0.0	0.0	0.0	0.0	0.0	0.0	0.0	1.2	0.0	0.0	0.0	0.0	0.0	0.4	1.0	0.5	1.3	0.4	0.4	0.5	1.2	2.0	0.3	3.0	8.9	0.8	0.0	2.6	0.0	3.2	0.0	1.4	3.4	0.0	0.0	0.1	0.0	0.1	3.8	4.7	0.0	0.0	0.2	0.1	2.6	0.2	1.1	0.0	1.1	0.0	0.0	22.7	3.0	2.1	3.1	0.5	3.3	0.0	0.0	0.4	0.1	0.0	70.4	0.7	0.5	116.4	56.5	0.9	0.7	1.6	0.2	0.0	0.0	0.3
BCHE	"CHE1, CHE2, E1"	ENSG00000114200	Butyrylcholinesterase	P06276	3	165772904-165837472	"Disease related genes, Enzymes, FDA approved drug targets, Plasma proteins, Predicted intracellular proteins, Predicted secreted proteins"		"Hydrolase, Serine esterase"	"Disease mutation, FDA approved drug targets"	"Evidence at protein level"	"Evidence at transcript level"	"Evidence at protein level"	"Evidence at protein level"	"Evidence at protein level"	"Tissue enriched"	"Detected in many"	6	"liver: 145.4"	"Cell type enriched"	"Detected in many"	10	"Hepatocytes: 360.7"	"Group enriched"	"Detected in many"	6	"glioma: 24.0;liver cancer: 13.7;melanoma: 18.9"	"Low region specificity"	"Detected in all"			"Not detected"	"Not detected"			"Not detected"	"Not detected"			"Cell line enriched"	"Detected in some"	9	"Karpas-707: 131.7"	"Low region specificity"	"Detected in all"							HPA001560	Approved				"Secreted to blood"	NA	NA		13000000000			"HPA001560: AB_1078271"	"unprognostic (4.74e-2)"	"unprognostic (2.00e-1)"	"unprognostic (9.21e-4)"	"unprognostic (8.19e-8)"	"unprognostic (2.66e-2)"	"prognostic unfavorable (1.06e-4)"	"unprognostic (1.44e-1)"	"unprognostic (5.04e-2)"	"unprognostic (6.15e-2)"	"unprognostic (9.59e-2)"	"unprognostic (5.15e-2)"	"unprognostic (3.65e-2)"	"unprognostic (3.18e-3)"	"unprognostic (4.46e-5)"	"unprognostic (2.17e-2)"	"unprognostic (5.92e-2)"	"unprognostic (4.26e-4)"	14.0	3.9	6.7	6.2	4.3	0.4	1.9	3.6	9.1	24.4	15.5	4.7	8.3	1.8	20.2	13.4	20.0	18.0	2.2	7.8	6.1	4.4	2.8	145.4	3.7	0.7	5.5	2.7	10.3	1.1	0.4	1.2	0.5	4.7	4.7	5.3	0.7	1.0	10.5	1.1	2.8	6.4	13.9	3.4	3.7	1.9	1.8	6.1	1.0	0.8	0.4	0.5	9.7	2.9	0.0	0.0	0.0	0.0	0.0	0.0	0.0	0.0	0.4	14.3	0.0	0.0	0.0	0.0	0.0	0.2	0.1	1.2	0.0	0.0	0.0	5.4	0.0	0.0	0.1	0.9	0.0	1.0	0.0	0.1	0.0	0.0	0.0	1.1	0.0	0.0	4.2	0.2	0.0	1.4	4.4	0.6	5.2	0.0	131.7	0.0	0.0	0.0	0.0	0.3	0.0	0.1	0.0	4.8	10.9	0.1	0.0	0.0	0.1	0.0	0.0	7.5	0.0	5.8	0.0	0.0	3.2	0.0	0.0	1.3	0.5	0.0	0.2	1.3	0.0	14.4	0.0	0.0	0.0	0.0	0.0	0.0	0.0	0.0	0.0	0.0	0.0	0.0	0.0	0.0	0.0	0.0	0.0	0.0	0.0	6.7	4.3	3.6	4.3	6.1	4.4	5.5	2.7	4.7	6.1	0.0	0.0	0.0	0.3	4.8	0.9	4.3	12.7	0.0	0.0	0.0	0.0	0.0	0.0	0.0	22.1	1.5	0.0	0.0	0.0	0.0	2.2	0.2	0.0	360.7	0.1	1.6	0.0	6.2	5.3	5.5	2.0	0.0	18.6	0.0	0.0	34.4	0.0	0.0	0.0	2.9	1.0	0.0	4.6	0.3	0.1	3.0	0.0	0.0	0.0	0.1
